{
  "$schema": "https://json-schema.org/draft/2020-12/schema",
  "$id": "urn:pxapi:schema:business-context:1.0.0",
  "title": "PXAPI business context v1",
  "description": "Output of the Business Context Analyzer model job (Confluence 39846055 §6): what kind of business the analysed website belongs to, stated as typed facts that are evidenced publicly. A research failure is explicit, never inferred from missing facts: a NOT_ASSESSED context carries a reason and no facts, and a COMPLETED context with an empty fact list means nothing could be publicly evidenced — neither is a statement about the quality of the business. Every VERIFIED_FACT and every SUPPORTED_INFERENCE cites at least one source; only a HYPOTHESIS may stand without one.",
  "type": "object",
  "properties": {
    "schema_version": {
      "$ref": "urn:pxapi:schema:common:1.0.0#/$defs/schema_version",
      "description": "Required. Always 1.0.0 for this contract."
    },
    "run_id": {
      "$ref": "urn:pxapi:schema:common:1.0.0#/$defs/id",
      "description": "Required. The Analysis Run this business context belongs to."
    },
    "generated_at": {
      "$ref": "urn:pxapi:schema:common:1.0.0#/$defs/timestamp",
      "description": "Required. When the business context was generated, or when the research was attempted for a NOT_ASSESSED context."
    },
    "producer_ref": {
      "$ref": "urn:pxapi:schema:common:1.0.0#/$defs/producer_ref",
      "description": "Required. What produced the business context; the model behind it is interchangeable."
    },
    "research_state": {
      "type": "string",
      "enum": ["COMPLETED", "NOT_ASSESSED"],
      "description": "Required. Whether the business research ran to completion. COMPLETED: the facts are the result, an empty list included. NOT_ASSESSED: the research did not happen; the context explains why and carries no facts."
    },
    "not_assessed_reason": {
      "$ref": "urn:pxapi:schema:common:1.0.0#/$defs/not_assessed_reason",
      "description": "Conditional. Present if and only if research_state is NOT_ASSESSED: why the business research did not happen. Every reason describes the analysis process, never the business."
    },
    "facts": {
      "type": "array",
      "items": { "$ref": "#/$defs/fact" },
      "description": "Required. The publicly evidenced facts about the business; intent sets and diagnosis claims reference them by fact_id. An empty array in a COMPLETED context means nothing could be publicly evidenced; in a NOT_ASSESSED context the array is always empty because no research happened, and carries no meaning of its own."
    }
  },
  "required": [
    "schema_version",
    "run_id",
    "generated_at",
    "producer_ref",
    "research_state",
    "facts"
  ],
  "additionalProperties": false,
  "allOf": [
    {
      "if": {
        "properties": { "research_state": { "const": "NOT_ASSESSED" } },
        "required": ["research_state"]
      },
      "then": {
        "required": ["not_assessed_reason"],
        "properties": {
          "facts": { "maxItems": 0 }
        }
      },
      "else": {
        "not": { "required": ["not_assessed_reason"] }
      }
    }
  ],
  "$defs": {
    "fact": {
      "type": "object",
      "properties": {
        "fact_id": {
          "$ref": "urn:pxapi:schema:common:1.0.0#/$defs/id",
          "description": "Required. The stable identity of this fact; intent sets and diagnosis claims reference it."
        },
        "category": {
          "type": "string",
          "enum": [
            "COMPANY",
            "OFFERING",
            "LOCATION_MARKET",
            "CUSTOMER_TYPE",
            "TARGET_GROUP",
            "BUSINESS_MODEL",
            "POSITIONING",
            "CUSTOMER_INTENT",
            "PURCHASE_QUESTION",
            "TRUST_FACTOR",
            "COMPETITOR",
            "COMPETITIVE_DIFFERENCE"
          ],
          "description": "Required. Which aspect of the business the fact describes (Confluence 39846055 §6)."
        },
        "statement": {
          "$ref": "urn:pxapi:schema:common:1.0.0#/$defs/text",
          "description": "Required. The fact itself, stated in evidence language as a single assertion."
        },
        "evidence_class": {
          "$ref": "urn:pxapi:schema:common:1.0.0#/$defs/evidence_class",
          "description": "Required. The authority of the statement. A VERIFIED_FACT or SUPPORTED_INFERENCE is backed by at least one source; a HYPOTHESIS may have none."
        },
        "source_refs": {
          "type": "array",
          "items": { "$ref": "urn:pxapi:schema:common:1.0.0#/$defs/source_ref" },
          "description": "Required. Where the fact was evidenced. At least one source for a VERIFIED_FACT or SUPPORTED_INFERENCE. An empty array means the statement rests on no public source, which is only legal for a HYPOTHESIS."
        },
        "confidence": {
          "$ref": "urn:pxapi:schema:common:1.0.0#/$defs/confidence",
          "description": "Required. Confidence in the fact on the 0..5 scale."
        }
      },
      "required": ["fact_id", "category", "statement", "evidence_class", "source_refs", "confidence"],
      "additionalProperties": false,
      "allOf": [
        {
          "if": {
            "properties": {
              "evidence_class": { "enum": ["VERIFIED_FACT", "SUPPORTED_INFERENCE"] }
            },
            "required": ["evidence_class"]
          },
          "then": {
            "properties": {
              "source_refs": { "minItems": 1 }
            }
          }
        }
      ]
    }
  }
}
