{
  "schema_version": "1.0.0",
  "run_id": "run_01J6ZK3M8Q0X4V9R2T7B5N1C6D",
  "generated_at": "2026-09-02T10:20:00Z",
  "producer_ref": { "kind": "model", "name": "business_context_analyzer", "version": "2026.09.0" },
  "research_state": "COMPLETED",
  "facts": [
    {
      "fact_id": "ctx_0001",
      "category": "COMPANY",
      "statement": "Example Handwerk GmbH is a limited company registered in Berlin and operates as a roofing and timber construction business (Dachdeckerei und Zimmerei).",
      "evidence_class": "VERIFIED_FACT",
      "source_refs": [
        { "kind": "public_register", "value": "handelsregister:HRB 123456 B" },
        {
          "kind": "http_response",
          "value": "https://www.example-handwerk.de/impressum",
          "retrieved_at": "2026-09-02T10:19:12Z"
        }
      ],
      "confidence": 5
    },
    {
      "fact_id": "ctx_0002",
      "category": "OFFERING",
      "statement": "The business offers roof renovation, roof repair, timber-frame construction and roof insulation.",
      "evidence_class": "VERIFIED_FACT",
      "source_refs": [
        {
          "kind": "http_response",
          "value": "https://www.example-handwerk.de/leistungen",
          "retrieved_at": "2026-09-02T10:19:14Z"
        }
      ],
      "confidence": 5
    },
    {
      "fact_id": "ctx_0003",
      "category": "LOCATION_MARKET",
      "statement": "The service area is Berlin and the surrounding Brandenburg municipalities; the reference projects name Berlin districts and Potsdam.",
      "evidence_class": "SUPPORTED_INFERENCE",
      "source_refs": [
        {
          "kind": "http_response",
          "value": "https://www.example-handwerk.de/referenzen",
          "retrieved_at": "2026-09-02T10:19:16Z"
        }
      ],
      "confidence": 4
    },
    {
      "fact_id": "ctx_0004",
      "category": "CUSTOMER_TYPE",
      "statement": "Customers are predominantly private homeowners; commercial roofing is mentioned only as a secondary line.",
      "evidence_class": "SUPPORTED_INFERENCE",
      "source_refs": [
        {
          "kind": "http_response",
          "value": "https://www.example-handwerk.de/referenzen",
          "retrieved_at": "2026-09-02T10:19:16Z"
        }
      ],
      "confidence": 3
    },
    {
      "fact_id": "ctx_0005",
      "category": "TRUST_FACTOR",
      "statement": "The owner holds the master craftsman title (Dachdeckermeister) and the business is a member of the Handwerkskammer Berlin.",
      "evidence_class": "VERIFIED_FACT",
      "source_refs": [
        {
          "kind": "http_response",
          "value": "https://www.example-handwerk.de/ueber-uns",
          "retrieved_at": "2026-09-02T10:19:18Z"
        }
      ],
      "confidence": 4
    },
    {
      "fact_id": "ctx_0006",
      "category": "PURCHASE_QUESTION",
      "statement": "Prospective customers want a cost estimate and a realistic lead time before commissioning a roof renovation; the contact page invites exactly these two questions.",
      "evidence_class": "SUPPORTED_INFERENCE",
      "source_refs": [
        {
          "kind": "http_response",
          "value": "https://www.example-handwerk.de/kontakt",
          "retrieved_at": "2026-09-02T10:19:20Z"
        }
      ],
      "confidence": 3
    },
    {
      "fact_id": "ctx_0007",
      "category": "COMPETITOR",
      "statement": "Regional roofing businesses with a comparable renovation offering compete for the same Berlin homeowners; the website names no competitor.",
      "evidence_class": "HYPOTHESIS",
      "source_refs": [],
      "confidence": 1
    }
  ]
}
